TYPECAST

CREATE TABLE T1(ID INT, AGE INT, NAME CHAR, SCORE FLOAT);
SUCCESS
INSERT INTO T1 VALUES(1,1, 'A', 1.0);
SUCCESS
INSERT INTO T1 VALUES(2,2, 'B', 2.0);
SUCCESS
CREATE TABLE T2(ID INT, AGE INT, NAME CHAR, SCORE FLOAT);
SUCCESS
INSERT INTO T2 VALUES(1,1, 'A', 1.0);
SUCCESS
INSERT INTO T2 VALUES(2,3, 'B', 2.0);
SUCCESS
CREATE TABLE T3(ID INT, AGE INT, NAME CHAR, SCORE FLOAT);
SUCCESS
INSERT INTO T3 VALUES(1,1, 'A', 1.0);
SUCCESS
INSERT INTO T3 VALUES(2,2, 'B', 2.0);
SUCCESS
UPDATE T3 SET NAME=2,AGE=2.0 WHERE ID=2;
SUCCESS
UPDATE T3 SET NAME = (SELECT MAX(AGE) FROM T2) WHERE ID=1;
SUCCESS
UPDATE T3 SET AGE=(SELECT MAX(T2.AGE) FROM T2),SCORE=(SELECT MAX(T2.SCORE) FROM T2) WHERE ID=1;
SUCCESS
UPDATE T1 SET AGE=(SELECT AGE FROM T1 WHERE ID=2) WHERE ID = 1;
SUCCESS
UPDATE T1 SET AGE=(SELECT AGE FROM T2 WHERE T2.ID=2) WHERE T1.ID = 1;
SUCCESS
UPDATE UPDATE_TABLE_NOT_EXIST SET T_NAME='N4',COL1=1 WHERE ID=1;
FAILURE

SELECT * FROM T1;
1 | 3 | A | 1
2 | 2 | B | 2
ID | AGE | NAME | SCORE

UPDATE T1 SET AGE=(SELECT AVG(AGE) FROM T2) WHERE ID=1;
SUCCESS
UPDATE T1 SET SCORE=(SELECT AVG(AGE) FROM T2) WHERE ID=1;
SUCCESS

SELECT * FROM T1;
1 | 2 | A | 2
2 | 2 | B | 2
ID | AGE | NAME | SCORE

UPDATE T1 SET AGE=(SELECT UPDATE_TABLE_NOT_EXIST.T_NAME FROM UPDATE_TABLE_NOT_EXIST WHERE UPDATE_TABLE_NOT_EXIST.ID=1) WHERE ID=1;
FAILURE

SELECT * FROM T2;
1 | 1 | A | 1
2 | 3 | B | 2
ID | AGE | NAME | SCORE

SELECT * FROM T3;
1 | 3 | 3 | 2
2 | 2 | 2 | 2
ID | AGE | NAME | SCORE
