INITIALIZATION
CREATE TABLE NULL_TABLE(ID INT, NUM INT NULLABLE, PRICE FLOAT NOT NULL, BIRTHDAY DATE NULLABLE);
SUCCESS
CREATE TABLE NULL_TABLE2(ID INT, NUM INT NULLABLE, PRICE FLOAT NOT NULL, BIRTHDAY DATE NULLABLE);
SUCCESS
CREATE INDEX INDEX_NUM ON NULL_TABLE(NUM);
SUCCESS

1. INSERT
INSERT INTO NULL_TABLE VALUES (1, 18, 10.0, '2020-01-01');
SUCCESS
INSERT INTO NULL_TABLE VALUES (2, NULL, 20.0, '2010-01-11');
SUCCESS
INSERT INTO NULL_TABLE VALUES (3, 12, 30.0, NULL);
SUCCESS
INSERT INTO NULL_TABLE VALUES (4, 15, 30.0, '2021-01-31');
SUCCESS
INSERT INTO NULL_TABLE2 VALUES (1, 18, 30.0, '2021-01-31');
SUCCESS
INSERT INTO NULL_TABLE2 VALUES (2, NULL, 40.0, NULL);
SUCCESS

INSERT INTO NULL_TABLE VALUES (5, 15, NULL, '2021-01-31');
FAILURE
INSERT INTO NULL_TABLE VALUES (NULL, 15, 30.0, '2021-01-31');
FAILURE

2. SELECT
SELECT * FROM NULL_TABLE;
1 | 18 | 10 | 2020-01-01
2 | NULL | 20 | 2010-01-11
3 | 12 | 30 | NULL
4 | 15 | 30 | 2021-01-31
ID | NUM | PRICE | BIRTHDAY

3. SELECT WITH CONSTANT
SELECT * FROM NULL_TABLE WHERE 1 IS NULL;
ID | NUM | PRICE | BIRTHDAY
SELECT * FROM NULL_TABLE WHERE 1 IS NOT NULL;
1 | 18 | 10 | 2020-01-01
2 | NULL | 20 | 2010-01-11
3 | 12 | 30 | NULL
4 | 15 | 30 | 2021-01-31
ID | NUM | PRICE | BIRTHDAY
SELECT * FROM NULL_TABLE WHERE NULL=1;
ID | NUM | PRICE | BIRTHDAY
SELECT * FROM NULL_TABLE WHERE 1=NULL;
ID | NUM | PRICE | BIRTHDAY
SELECT * FROM NULL_TABLE WHERE 1<>NULL;
ID | NUM | PRICE | BIRTHDAY
SELECT * FROM NULL_TABLE WHERE 1<NULL;
ID | NUM | PRICE | BIRTHDAY
SELECT * FROM NULL_TABLE WHERE 1>NULL;
ID | NUM | PRICE | BIRTHDAY

SELECT * FROM NULL_TABLE WHERE NULL IS NULL;
1 | 18 | 10 | 2020-01-01
2 | NULL | 20 | 2010-01-11
3 | 12 | 30 | NULL
4 | 15 | 30 | 2021-01-31
ID | NUM | PRICE | BIRTHDAY
SELECT * FROM NULL_TABLE WHERE NULL IS NOT NULL;
ID | NUM | PRICE | BIRTHDAY
SELECT * FROM NULL_TABLE WHERE NULL=NULL;
ID | NUM | PRICE | BIRTHDAY
SELECT * FROM NULL_TABLE WHERE NULL<>NULL;
ID | NUM | PRICE | BIRTHDAY
SELECT * FROM NULL_TABLE WHERE NULL>NULL;
ID | NUM | PRICE | BIRTHDAY
SELECT * FROM NULL_TABLE WHERE NULL<NULL;
ID | NUM | PRICE | BIRTHDAY

SELECT * FROM NULL_TABLE WHERE 'A' IS NULL;
ID | NUM | PRICE | BIRTHDAY
SELECT * FROM NULL_TABLE WHERE 'A' IS NOT NULL;
1 | 18 | 10 | 2020-01-01
2 | NULL | 20 | 2010-01-11
3 | 12 | 30 | NULL
4 | 15 | 30 | 2021-01-31
ID | NUM | PRICE | BIRTHDAY
SELECT * FROM NULL_TABLE WHERE NULL='A';
ID | NUM | PRICE | BIRTHDAY
SELECT * FROM NULL_TABLE WHERE 'A'=NULL;
ID | NUM | PRICE | BIRTHDAY
SELECT * FROM NULL_TABLE WHERE 'A'<>NULL;
ID | NUM | PRICE | BIRTHDAY
SELECT * FROM NULL_TABLE WHERE 'A'>NULL;
ID | NUM | PRICE | BIRTHDAY
SELECT * FROM NULL_TABLE WHERE 'A'<NULL;
ID | NUM | PRICE | BIRTHDAY

SELECT * FROM NULL_TABLE WHERE '2021-01-31' IS NULL;
ID | NUM | PRICE | BIRTHDAY
SELECT * FROM NULL_TABLE WHERE '2021-01-31' IS NOT NULL;
1 | 18 | 10 | 2020-01-01
2 | NULL | 20 | 2010-01-11
3 | 12 | 30 | NULL
4 | 15 | 30 | 2021-01-31
ID | NUM | PRICE | BIRTHDAY
SELECT * FROM NULL_TABLE WHERE NULL='2021-01-31';
ID | NUM | PRICE | BIRTHDAY
SELECT * FROM NULL_TABLE WHERE '2021-01-31'=NULL;
ID | NUM | PRICE | BIRTHDAY
SELECT * FROM NULL_TABLE WHERE '2021-01-31'>NULL;
ID | NUM | PRICE | BIRTHDAY
SELECT * FROM NULL_TABLE WHERE '2021-01-31'<NULL;
ID | NUM | PRICE | BIRTHDAY

4. SELECT WITH COLUMN
SELECT * FROM NULL_TABLE WHERE BIRTHDAY IS NOT NULL;
1 | 18 | 10 | 2020-01-01
2 | NULL | 20 | 2010-01-11
4 | 15 | 30 | 2021-01-31
ID | NUM | PRICE | BIRTHDAY
SELECT * FROM NULL_TABLE WHERE BIRTHDAY IS NULL;
3 | 12 | 30 | NULL
ID | NUM | PRICE | BIRTHDAY
SELECT * FROM NULL_TABLE WHERE BIRTHDAY = NULL;
ID | NUM | PRICE | BIRTHDAY
SELECT * FROM NULL_TABLE WHERE NULL = BIRTHDAY;
ID | NUM | PRICE | BIRTHDAY
SELECT * FROM NULL_TABLE WHERE BIRTHDAY <> NULL;
ID | NUM | PRICE | BIRTHDAY
SELECT * FROM NULL_TABLE WHERE BIRTHDAY > NULL;
ID | NUM | PRICE | BIRTHDAY
SELECT * FROM NULL_TABLE WHERE BIRTHDAY < NULL;
ID | NUM | PRICE | BIRTHDAY

SELECT * FROM NULL_TABLE WHERE NUM IS NOT NULL;
1 | 18 | 10 | 2020-01-01
3 | 12 | 30 | NULL
4 | 15 | 30 | 2021-01-31
ID | NUM | PRICE | BIRTHDAY
SELECT * FROM NULL_TABLE WHERE NUM IS NULL;
2 | NULL | 20 | 2010-01-11
ID | NUM | PRICE | BIRTHDAY
SELECT * FROM NULL_TABLE WHERE NUM = NULL;
ID | NUM | PRICE | BIRTHDAY
SELECT * FROM NULL_TABLE WHERE NULL = NUM;
ID | NUM | PRICE | BIRTHDAY
SELECT * FROM NULL_TABLE WHERE NUM <> NULL;
ID | NUM | PRICE | BIRTHDAY
SELECT * FROM NULL_TABLE WHERE NUM > NULL;
ID | NUM | PRICE | BIRTHDAY
SELECT * FROM NULL_TABLE WHERE NUM < NULL;
ID | NUM | PRICE | BIRTHDAY

SELECT NULL_TABLE.NUM,NULL_TABLE2.NUM,NULL_TABLE.BIRTHDAY FROM NULL_TABLE,NULL_TABLE2 WHERE NULL_TABLE.NUM=NULL_TABLE2.NUM;
18 | 18 | 2020-01-01
NULL_TABLE.NUM | NULL_TABLE2.NUM | NULL_TABLE.BIRTHDAY

5. AGGREGATION
SELECT COUNT(*) FROM NULL_TABLE;
COUNT(*)
4
SELECT COUNT(PRICE) FROM NULL_TABLE;
COUNT(PRICE)
4
SELECT COUNT(BIRTHDAY) FROM NULL_TABLE;
COUNT(BIRTHDAY)
3
SELECT AVG(NUM) FROM NULL_TABLE;
AVG(NUM)
15

6. AGGREGATION WITH NULL COLUMNS
CREATE TABLE NULL_TABLE3(ID INT, NUM INT NULLABLE);
SUCCESS
INSERT INTO NULL_TABLE3 VALUES (1, NULL);
SUCCESS
INSERT INTO NULL_TABLE3 VALUES (2, NULL);
SUCCESS
SELECT COUNT(NUM) FROM NULL_TABLE3;
COUNT(NUM)
0
SELECT MIN(NUM) FROM NULL_TABLE3;
MIN(NUM)
NULL
SELECT MAX(NUM) FROM NULL_TABLE3;
MAX(NUM)
NULL
SELECT AVG(NUM) FROM NULL_TABLE3;
AVG(NUM)
NULL

7. UNIQUE AND DELETE
CREATE TABLE NULL_TABLE4(ID1 INT NULLABLE, ID2 INT NULLABLE, ID3 FLOAT NULLABLE);
SUCCESS
CREATE UNIQUE INDEX ID1_ID2 ON NULL_TABLE4(ID1, ID2);
SUCCESS
INSERT INTO NULL_TABLE4 VALUES (1, NULL, 1);
SUCCESS
INSERT INTO NULL_TABLE4 VALUES (1, NULL, NULL);
SUCCESS
INSERT INTO NULL_TABLE4 VALUES (NULL, NULL, NULL);
SUCCESS
INSERT INTO NULL_TABLE4 VALUES (NULL, NULL, 1.4);
SUCCESS
INSERT INTO NULL_TABLE4 VALUES (2, 2, 1.2);
SUCCESS
INSERT INTO NULL_TABLE4 VALUES (2, 2, 1.3);
FAILURE

SELECT * FROM NULL_TABLE4;
1 | NULL | 1
1 | NULL | NULL
2 | 2 | 1.2
ID1 | ID2 | ID3
NULL | NULL | 1.4
NULL | NULL | NULL

DELETE FROM NULL_TABLE4 WHERE ID2 = NULL;
SUCCESS

SELECT * FROM NULL_TABLE4;
1 | NULL | 1
1 | NULL | NULL
2 | 2 | 1.2
ID1 | ID2 | ID3
NULL | NULL | 1.4
NULL | NULL | NULL

DELETE FROM NULL_TABLE4 WHERE ID1 = 1 AND ID2 = NULL;
SUCCESS

SELECT * FROM NULL_TABLE4;
1 | NULL | 1
1 | NULL | NULL
2 | 2 | 1.2
ID1 | ID2 | ID3
NULL | NULL | 1.4
NULL | NULL | NULL

DELETE FROM NULL_TABLE4 WHERE ID2 IS NULL AND ID1 IS NOT NULL;
SUCCESS

SELECT * FROM NULL_TABLE4;
2 | 2 | 1.2
ID1 | ID2 | ID3
NULL | NULL | 1.4
NULL | NULL | NULL

DELETE FROM NULL_TABLE4 WHERE ID1 = 2;
SUCCESS

SELECT * FROM NULL_TABLE4;
ID1 | ID2 | ID3
NULL | NULL | 1.4
NULL | NULL | NULL

DELETE FROM NULL_TABLE4 WHERE ID3 = 1.4;
SUCCESS

SELECT * FROM NULL_TABLE4;
ID1 | ID2 | ID3
NULL | NULL | NULL

8. UPDATE & TYPECAST
CREATE TABLE NULL_TABLE5(ID INT NULLABLE, NUM INT NULLABLE, NAME CHAR NULLABLE, NAME2 CHAR NOT NULL);
SUCCESS
CREATE INDEX ID_T5 ON NULL_TABLE5(ID);
SUCCESS
INSERT INTO NULL_TABLE5 VALUES (1, 1, 'N1', 'N1');
SUCCESS
INSERT INTO NULL_TABLE5 VALUES (2, 2, 'N2', 'N2');
SUCCESS
INSERT INTO NULL_TABLE5 VALUES (3, 3, 'N3', 'N3');
SUCCESS
INSERT INTO NULL_TABLE5 VALUES (3, 3, 'N3', NULL);
FAILURE
UPDATE NULL_TABLE5 SET NUM=NULL WHERE ID=1;
SUCCESS
UPDATE NULL_TABLE5 SET NAME=NULL WHERE NUM=NULL;
SUCCESS

SELECT ID, NUM, NAME FROM NULL_TABLE5;
1 | NULL | N1
2 | 2 | N2
3 | 3 | N3
ID | NUM | NAME

UPDATE NULL_TABLE5 SET NAME=NULL WHERE NUM IS NULL;
SUCCESS

SELECT ID, NUM, NAME FROM NULL_TABLE5;
1 | NULL | NULL
2 | 2 | N2
3 | 3 | N3
ID | NUM | NAME

UPDATE NULL_TABLE5 SET ID=NULL WHERE NUM=2;
SUCCESS

SELECT ID, NUM, NAME FROM NULL_TABLE5;
1 | NULL | NULL
3 | 3 | N3
ID | NUM | NAME
NULL | 2 | N2

UPDATE NULL_TABLE5 SET ID=(SELECT NULL_TABLE5.ID FROM NULL_TABLE5 WHERE NULL_TABLE5.NUM=2) WHERE ID=3;
SUCCESS

SELECT * FROM NULL_TABLE5;
1 | NULL | NULL | N1
ID | NUM | NAME | NAME2
NULL | 2 | N2 | N2
NULL | 3 | N3 | N3

UPDATE NULL_TABLE5 SET NAME2=(SELECT NULL_TABLE5.ID FROM NULL_TABLE5 WHERE NULL_TABLE5.NUM=2) WHERE ID=1;
FAILURE

SELECT * FROM NULL_TABLE5;
1 | NULL | NULL | N1
ID | NUM | NAME | NAME2
NULL | 2 | N2 | N2
NULL | 3 | N3 | N3

UPDATE NULL_TABLE5 SET NAME=(SELECT ID FROM NULL_TABLE5 WHERE NUM=30) WHERE NUM=2;
SUCCESS

SELECT * FROM NULL_TABLE5;
1 | NULL | NULL | N1
ID | NUM | NAME | NAME2
NULL | 2 | NULL | N2
NULL | 3 | N3 | N3

UPDATE NULL_TABLE5 SET NAME=(SELECT ID FROM NULL_TABLE5 WHERE ID=1) WHERE NUM=2;
SUCCESS

SELECT * FROM NULL_TABLE5;
1 | NULL | NULL | N1
ID | NUM | NAME | NAME2
NULL | 2 | 1 | N2
NULL | 3 | N3 | N3

UPDATE NULL_TABLE5 SET NAME=(SELECT NULL_TABLE3.NUM FROM NULL_TABLE3 WHERE NULL_TABLE3.ID=1) WHERE NUM=2;
SUCCESS

SELECT * FROM NULL_TABLE5;
1 | NULL | NULL | N1
ID | NUM | NAME | NAME2
NULL | 2 | NULL | N2
NULL | 3 | N3 | N3

UPDATE NULL_TABLE5 SET NAME=(SELECT NULL_TABLE3.NUM FROM NULL_TABLE3 WHERE NULL_TABLE3.ID=1) WHERE ID=1;
SUCCESS

SELECT * FROM NULL_TABLE5;
1 | NULL | NULL | N1
ID | NUM | NAME | NAME2
NULL | 2 | NULL | N2
NULL | 3 | N3 | N3

UPDATE NULL_TABLE5 SET ID=1 WHERE ID IS NULL;
SUCCESS
UPDATE NULL_TABLE5 SET ID=2 WHERE NUM=3;
SUCCESS
UPDATE NULL_TABLE5 SET NAME=(SELECT NULL_TABLE3.NUM FROM NULL_TABLE3 WHERE NULL_TABLE3.ID=1) WHERE ID=2;
SUCCESS

SELECT * FROM NULL_TABLE5;
1 | 2 | NULL | N2
1 | NULL | NULL | N1
2 | 3 | NULL | N3
ID | NUM | NAME | NAME2

UPDATE NULL_TABLE5 SET NAME2=NULL WHERE NUM IS NULL;
FAILURE
UPDATE NULL_TABLE5 SET NAME2 IS NULL WHERE NUM IS NULL;
FAILURE
UPDATE NULL_TABLE5 SET NUM=(SELECT NULL_TABLE3.NUM FROM NULL_TABLE3 WHERE NULL_TABLE3.ID=1) WHERE NAME2='N2';
SUCCESS

SELECT * FROM NULL_TABLE5;
1 | NULL | NULL | N1
1 | NULL | NULL | N2
2 | 3 | NULL | N3
ID | NUM | NAME | NAME2

CREATE TABLE NULL_TABLE6(ID INT, NUM INT NULLABLE, NAME CHAR NULLABLE);
SUCCESS
INSERT INTO NULL_TABLE6 VALUES(1, 1, 'N1');
SUCCESS
INSERT INTO NULL_TABLE6 VALUES(2, 2, 'N2');
SUCCESS
INSERT INTO NULL_TABLE6 VALUES(3, 3, 'N3');
SUCCESS
UPDATE NULL_TABLE6 SET NUM=NULL WHERE ID=1;
SUCCESS
UPDATE NULL_TABLE6 SET NAME=NULL WHERE NUM=NULL;
SUCCESS

SELECT * FROM NULL_TABLE6;
1 | NULL | N1
2 | 2 | N2
3 | 3 | N3
ID | NUM | NAME

UPDATE NULL_TABLE6 SET ID=NULL WHERE NUM IS NULL;
FAILURE
UPDATE NULL_TABLE6 SET NAME=NULL WHERE NUM IS NULL;
SUCCESS
UPDATE NULL_TABLE6 SET NUM=(SELECT NULL_TABLE3.NUM FROM NULL_TABLE3 WHERE NULL_TABLE3.ID=1) WHERE ID=2;
SUCCESS

SELECT * FROM NULL_TABLE6;
1 | NULL | NULL
2 | NULL | N2
3 | 3 | N3
ID | NUM | NAME
