INITIALIZATION
CREATE TABLE UNIQUE_TABLE(ID INT, COL1 INT, COL2 INT);
SUCCESS
INSERT INTO UNIQUE_TABLE VALUES (1,1,1);
SUCCESS

1. UNIQUE TEST
CREATE UNIQUE INDEX INDEX_ID ON UNIQUE_TABLE(ID);
SUCCESS
INSERT INTO UNIQUE_TABLE VALUES (2,1,1);
SUCCESS
CREATE UNIQUE INDEX INDEX_ID ON UNIQUE_TABLE(ID);
FAILURE
INSERT INTO UNIQUE_TABLE VALUES (3,2,1);
SUCCESS
INSERT INTO UNIQUE_TABLE VALUES (1,2,1);
FAILURE

2. SELECT
SELECT * FROM UNIQUE_TABLE;
1 | 1 | 1
2 | 1 | 1
3 | 2 | 1
ID | COL1 | COL2

CREATE TABLE UNIQUE_TABLE2(ID1 INT, ID2 INT, COL1 INT, COL2 INT);
SUCCESS
CREATE UNIQUE INDEX INDEX_ID ON UNIQUE_TABLE2(ID1, ID2);
SUCCESS
INSERT INTO UNIQUE_TABLE2 VALUES (1,1,1,1);
SUCCESS
INSERT INTO UNIQUE_TABLE2 VALUES (2,2,2,2);
SUCCESS
INSERT INTO UNIQUE_TABLE2 VALUES (3,3,3,3);
SUCCESS
INSERT INTO UNIQUE_TABLE2 VALUES (4,4,4,4);
SUCCESS
INSERT INTO UNIQUE_TABLE2 VALUES (4,4,5,5);
FAILURE

SELECT * FROM UNIQUE_TABLE2;
1 | 1 | 1 | 1
2 | 2 | 2 | 2
3 | 3 | 3 | 3
4 | 4 | 4 | 4
ID1 | ID2 | COL1 | COL2

3. UPDATE-SELECT
UPDATE UNIQUE_TABLE2 SET ID1=1, COL1=4 WHERE COL1=2;
SUCCESS

SELECT * FROM UNIQUE_TABLE2;
1 | 1 | 1 | 1
1 | 2 | 4 | 2
3 | 3 | 3 | 3
4 | 4 | 4 | 4
ID1 | ID2 | COL1 | COL2

UPDATE UNIQUE_TABLE2 SET ID1=1, ID2=1 WHERE COL1=4;
FAILURE

SELECT * FROM UNIQUE_TABLE2;
1 | 1 | 1 | 1
1 | 2 | 4 | 2
3 | 3 | 3 | 3
4 | 4 | 4 | 4
ID1 | ID2 | COL1 | COL2

UPDATE UNIQUE_TABLE2 SET ID1=10, COL2=40 WHERE COL1=4;
SUCCESS

SELECT * FROM UNIQUE_TABLE2;
1 | 1 | 1 | 1
10 | 2 | 4 | 40
10 | 4 | 4 | 40
3 | 3 | 3 | 3
ID1 | ID2 | COL1 | COL2
